{
  "commit": "9966894811d14eb132f061431e0dc2187b5dd3f6",
  "evidence_hash": "77d91d859c15be205bc05eaf7234540ba20885cf489173eb0e68afdbeb6d8458",
  "evidence_hash_algo": "sha256(git_rev_parse_HEAD)",
  "contract_hash": "d69a3444de6b99bb6a919c11003d69d6900681943f00b8d081cc037a52f996ad",
  "contract_hash_algo": "sha256(contracts/DealGuard.py)",
  "timestamp": "2026-09-18T12:19:00Z",
  "note": "Pinned code snapshot for Agent Tank validators"
}
